{
  "fixture_version": 1,
  "kind": "subtask-drafts",
  "metadata": {
    "source": "synthetic-sanitized",
    "version": "5.0",
    "sanitized": true,
    "semantic_capability": "refinement.decompose"
  },
  "expected": {
    "uncovered": [],
    "oversized_rejected": true
  },
  "data": {
    "content_language": "vi-VN",
    "story_ref": "story-2",
    "goal": {
      "goal_name": "Verify the rollback guide",
      "target_completion_date": "2026-08-07",
      "definition_of_done": [
        "A maintainer completes the rollback guide without undocumented steps",
        "The reviewed guide links the successful validation evidence"
      ],
      "requirements": ["REQ-2"],
      "acceptance_criteria": [
        {
          "id": "AC-2",
          "statement": "Maintainer hoàn tất hướng dẫn rollback mà không gặp bước chưa được mô tả",
          "verification": "Thực hiện walkthrough trong dự án tạm và ghi nhận không còn bước chưa xác định",
          "requirement_refs": ["REQ-2"]
        }
      ]
    },
    "subtasks": [
      {
        "draft_ref": "subtask-3",
        "title": "Run the rollback guide walkthrough",
        "outcome": "Every undocumented rollback step is identified",
        "in_scope": ["rollback guide"],
        "out_of_scope": ["production rollback"],
        "steps": ["follow the guide in a temporary project", "record gaps"],
        "affected_files": ["docs/rollback.md"],
        "dependencies": [],
        "validation": "walkthrough notes contain no unresolved step",
        "definition_of_done": "All guide gaps are recorded with a verification step",
        "estimate_hours": 2,
        "requirements": ["REQ-2"],
        "parent_acceptance_criteria_refs": ["AC-2"],
        "acceptance_criteria": [
          {
            "id": "AC-1",
            "statement": "Mọi bước rollback chưa được mô tả đều được ghi nhận",
            "verification": "walkthrough notes contain no unresolved step",
            "validation_ref": "VAL-1",
            "definition_of_done_ref": "DOD-1"
          }
        ]
      },
      {
        "draft_ref": "subtask-4",
        "title": "Verify the corrected rollback guide",
        "outcome": "A second walkthrough completes without undocumented steps",
        "in_scope": ["corrected rollback guide"],
        "out_of_scope": ["production rollback"],
        "steps": ["repeat the temporary-project walkthrough", "link sanitized evidence"],
        "affected_files": ["docs/rollback.md", "docs/manual-smoke-tests.md"],
        "dependencies": ["subtask-3"],
        "validation": "second walkthrough passes",
        "definition_of_done": "The reviewed guide links the passing walkthrough evidence",
        "estimate_hours": 3,
        "requirements": ["REQ-2"],
        "parent_acceptance_criteria_refs": ["AC-2"],
        "acceptance_criteria": [
          {
            "id": "AC-1",
            "statement": "Walkthrough lần hai hoàn tất mà không có bước chưa được mô tả",
            "verification": "second walkthrough passes",
            "validation_ref": "VAL-1",
            "definition_of_done_ref": "DOD-1"
          }
        ]
      }
    ],
    "traceability": {
      "requirements": {"REQ-2": ["subtask-3", "subtask-4"]},
      "parent_acceptance_criteria": {"AC-2": ["subtask-3", "subtask-4"]},
      "goal_definition_of_done": {"DOD-1": ["subtask-3"], "DOD-2": ["subtask-4"]}
    }
  }
}
