{
  "fixture_version": 1,
  "kind": "mcp-full",
  "metadata": {
    "source": "synthetic-sanitized",
    "version": "5.0",
    "sanitized": true,
    "semantic_capability": "mcp.compatibility"
  },
  "expected": {
    "result": "compatible"
  },
  "data": {
    "tools": [
      {
        "name": "jira_search",
        "description": "Search Jira issues",
        "access": "read",
        "schema": {
          "project": "string",
          "jql": "string"
        }
      },
      {
        "name": "jira_update",
        "description": "Update Jira issue fields",
        "access": "write",
        "permission": "ask",
        "schema": {
          "issue_key": "string",
          "fields": "object"
        }
      },
      {
        "name": "confluence_get",
        "description": "Read a Confluence page with version",
        "access": "read",
        "schema": {
          "page_id": "string"
        }
      },
      {
        "name": "confluence_update",
        "description": "Update a Confluence page",
        "access": "write",
        "permission": "ask",
        "schema": {
          "page_id": "string",
          "version": "integer",
          "content": "string"
        }
      }
    ],
    "result": "compatible"
  }
}
