{
  "fixture_version": 1,
  "kind": "two-week-deliverables",
  "metadata": {
    "source": "synthetic-sanitized",
    "version": "5.0",
    "sanitized": true,
    "semantic_capability": "workflow.plan"
  },
  "expected": {
    "writes": 0
  },
  "data": {
    "candidates": [
      {
        "id": "DLV-20260801-01",
        "class": "Ready-backed",
        "outcome": "Operators restore v5 safely",
        "primary_epic": "AIPLATFORM-100",
        "stories": [
          "AIPLATFORM-101"
        ],
        "goals": [
          {
            "story_ref": "AIPLATFORM-101",
            "goal_name": "Restore v5 upgrades safely",
            "target_completion_date": "2026-08-07",
            "target_completion_date_evidence": {
              "source": "sprint-end",
              "reference": "AIPLATFORM Sprint 7 ends 2026-08-07",
              "verified": true
            },
            "definition_of_done": ["Rollback drill evidence is accepted"],
            "canonical_spec": "Confluence page-200",
            "requirements": ["REQ-1"],
            "acceptance_criteria": [
              {
                "id": "AC-1",
                "statement": "Bản nâng cấp v5 được khôi phục an toàn trong rollback drill",
                "verification": "rollback drill passes",
                "requirement_refs": ["REQ-1"]
              }
            ],
            "epic_parent": "AIPLATFORM-100",
            "readiness": "ready",
            "subtasks": [
              {
                "ref": "AIPLATFORM-102",
                "summary": "Run rollback drill",
                "outcome": "Rollback behavior is verified",
                "in_scope": ["rollback drill"],
                "out_of_scope": ["production rollback"],
                "steps": ["run the rollback drill", "record the result"],
                "affected_files": ["docs/rollback.md"],
                "validation": "rollback drill",
                "definition_of_done": "Drill evidence is attached",
                "dependencies": [],
                "estimate_hours": 3,
                "requirements": ["REQ-1"],
                "parent_acceptance_criteria_refs": ["AC-1"],
                "content_language": "vi-VN",
                "acceptance_criteria_storage": "managed-description-section",
                "acceptance_criteria": [
                  {
                    "id": "AC-1",
                    "statement": "Bằng chứng rollback drill được lưu trong hồ sơ nghiệm thu",
                    "verification": "review rollback drill evidence checklist",
                    "validation_ref": "VAL-1",
                    "definition_of_done_ref": "DOD-1"
                  }
                ]
              },
              {
                "ref": "AIPLATFORM-103",
                "summary": "Review rollback evidence",
                "outcome": "Rollback evidence is accepted",
                "in_scope": ["rollback evidence"],
                "out_of_scope": ["production changes"],
                "steps": ["review the rollback evidence", "record the decision"],
                "affected_files": ["docs/manual-smoke-tests.md"],
                "validation": "review rollback evidence checklist",
                "definition_of_done": "Review is recorded",
                "dependencies": ["AIPLATFORM-102"],
                "estimate_hours": 2,
                "requirements": ["REQ-1"],
                "parent_acceptance_criteria_refs": ["AC-1"],
                "content_language": "vi-VN",
                "acceptance_criteria_storage": "managed-description-section",
                "acceptance_criteria": [
                  {
                    "id": "AC-1",
                    "statement": "Kết quả review rollback được ghi nhận đầy đủ",
                    "verification": "review rollback evidence checklist",
                    "validation_ref": "VAL-1",
                    "definition_of_done_ref": "DOD-1"
                  }
                ]
              }
            ],
            "traceability": {
              "requirements": {"REQ-1": ["AIPLATFORM-102", "AIPLATFORM-103"]},
              "acceptance_criteria": {"AC-1": ["AIPLATFORM-102", "AIPLATFORM-103"]},
              "goal_definition_of_done": {"DOD-1": ["AIPLATFORM-102", "AIPLATFORM-103"]}
            },
            "traceability_complete": true,
            "deadline_exception_approved": false
          }
        ],
        "target_sprint": "N+1",
        "target_sprint_end": "2026-08-07",
        "week_1_outcome": "Backup verified",
        "week_2_outcome": "Rollback drill accepted",
        "acceptance_signal": "drill passes",
        "rationale": "reduce release risk",
        "evidence": [
          "ready Story"
        ],
        "assumptions": [],
        "hypotheses": [],
        "readiness": "ready",
        "capacity_fit": "verified",
        "dependencies": [],
        "wip_impact": "within limit",
        "risk": "medium",
        "confidence": "high"
      },
      {
        "id": "DLV-20260801-02",
        "class": "New hypothesis",
        "outcome": "Automate every migration",
        "primary_epic": "AIPLATFORM-100",
        "stories": [
          "New candidate"
        ],
        "goals": [
          {
            "story_ref": "draft-goal-hypothesis",
            "goal_name": "Automation hypothesis",
            "target_completion_date": null,
            "definition_of_done": [],
            "epic_parent": "AIPLATFORM-100",
            "readiness": "not verified",
            "subtasks": [],
            "traceability_complete": false,
            "deadline_exception_approved": false
          }
        ],
        "target_sprint": "N+2",
        "target_sprint_end": "2026-08-14",
        "week_1_outcome": "evidence gathered",
        "week_2_outcome": "hypothesis reviewed",
        "acceptance_signal": "decision recorded",
        "rationale": "possible efficiency",
        "evidence": [],
        "assumptions": [
          "repeat demand"
        ],
        "hypotheses": [
          "automation pays back"
        ],
        "readiness": "not ready",
        "capacity_fit": "not feasible",
        "dependencies": [
          "decision"
        ],
        "wip_impact": "unknown",
        "risk": "high",
        "confidence": "low"
      },
      {
        "id": "DLV-20260801-03",
        "class": "Refinement candidate",
        "outcome": "Dependency risk is removed",
        "primary_epic": "AIPLATFORM-100",
        "stories": [
          "AIPLATFORM-202"
        ],
        "goals": [
          {
            "story_ref": "AIPLATFORM-202",
            "goal_name": "Remove dependency risk",
            "target_completion_date": null,
            "definition_of_done": ["The dependent Goal is unblocked"],
            "epic_parent": "AIPLATFORM-100",
            "readiness": "needs refinement",
            "subtasks": [
              {"ref": "AIPLATFORM-203", "estimate_hours": 2}
            ],
            "traceability_complete": false,
            "deadline_exception_approved": false
          }
        ],
        "target_sprint": "N+2",
        "target_sprint_end": "2026-08-14",
        "week_1_outcome": "dependency evidence gathered",
        "week_2_outcome": "dependency removed",
        "acceptance_signal": "dependent Story unblocked",
        "rationale": "protect critical path",
        "evidence": [
          "blocked Story"
        ],
        "assumptions": [],
        "hypotheses": [],
        "readiness": "needs refinement",
        "capacity_fit": "not feasible",
        "dependencies": [
          "architecture decision"
        ],
        "wip_impact": "requires refinement capacity",
        "risk": "medium",
        "confidence": "medium"
      }
    ],
    "scenarios": [
      {
        "name": "Flow-first",
        "selected": [
          "DLV-20260801-01"
        ],
        "displaced_work": [
          "DLV-20260801-02",
          "DLV-20260801-03"
        ],
        "trade_off": "finish ready work",
        "deadline_impact": "Protects Restore v5 upgrades safely by 2026-08-07; moves unready Goals out of commitment"
      },
      {
        "name": "Risk-reduction",
        "selected": [
          "DLV-20260801-03"
        ],
        "displaced_work": [
          "DLV-20260801-01",
          "DLV-20260801-02"
        ],
        "trade_off": "spend capacity on dependency refinement",
        "deadline_impact": "Puts the 2026-08-07 restore Goal at risk while clarifying the undated dependency Goal"
      },
      {
        "name": "Value-first",
        "selected": [],
        "displaced_work": [
          "DLV-20260801-01",
          "DLV-20260801-02",
          "DLV-20260801-03"
        ],
        "trade_off": "No evidence-based recommendation without value evidence",
        "deadline_impact": "No Goal deadline is protected without sufficient value and readiness evidence"
      }
    ],
    "recommendation": "DLV-20260801-01",
    "displaced_work": [
      "DLV-20260801-02"
    ],
    "page_proposal": {
      "ownership": "jiraman-managed",
      "current_version": 2,
      "operation": "page.update"
    }
  }
}
