{
  "fixture_version": 1,
  "kind": "report-contract",
  "metadata": {
    "source": "synthetic-sanitized",
    "version": "5.0",
    "sanitized": true,
    "semantic_capability": "confluence.report.propose"
  },
  "expected": {
    "writes": 0,
    "sections": [
      "executive_summary",
      "delivered_outcomes",
      "sprint_goal",
      "flow_constraints",
      "next_outcomes",
      "risks",
      "dependencies",
      "decisions_required",
      "scope_changes",
      "assumptions",
      "evidence_confidence"
    ]
  },
  "data": {
    "retrieved_at": "2026-08-01T00:00:00Z",
    "sources": [
      "Jira sprint 7",
      "Confluence weekly status"
    ],
    "history": "not verified",
    "ownership": "jiraman-managed",
    "current_version": 3,
    "unchanged": false
  }
}
